{
  "$schema": "http://json-schema.org/draft-07/schema#",
  "title": "Simple Answer Architecture Schema",
  "description": "Esquema simplificado para el contexto arquitectónico del proyecto Simple Answer",
  "type": "object",
  "required": ["schema_version", "project_name", "created_on", "last_updated"],
  "properties": {
    "schema_version": {
      "type": "string",
      "pattern": "^\\d+\\.\\d+\\.\\d+$",
      "description": "Versión del esquema (semver)"
    },
    "project_name": {
      "type": "string",
      "description": "Nombre del proyecto"
    },
    "created_on": {
      "type": "string",
      "format": "date-time",
      "description": "Timestamp ISO-8601 de creación"
    },
    "last_updated": {
      "type": "string",
      "format": "date-time",
      "description": "Timestamp ISO-8601 de última actualización"
    },
    "purpose": {
      "type": "string",
      "description": "Propósito principal del proyecto"
    },
    "core_technologies": {
      "type": "array",
      "items": {
        "type": "string"
      },
      "description": "Tecnologías principales utilizadas"
    },
    "components": {
      "type": "array",
      "items": {
        "type": "object",
        "required": ["name", "path", "description"],
        "properties": {
          "name": {
            "type": "string"
          },
          "path": {
            "type": "string"
          },
          "description": {
            "type": "string"
          },
          "responsibilities": {
            "type": "array",
            "items": {
              "type": "string"
            }
          }
        }
      },
      "description": "Componentes principales del proyecto"
    },
    "decisions": {
      "type": "array",
      "items": {
        "type": "object",
        "required": ["id", "date", "decision", "rationale"],
        "properties": {
          "id": {
            "type": "string"
          },
          "date": {
            "type": "string"
          },
          "decision": {
            "type": "string"
          },
          "rationale": {
            "type": "string"
          },
          "status": {
            "type": "string",
            "enum": ["Propuesto", "Implementado", "Obsoleto"],
            "default": "Implementado"
          }
        }
      },
      "description": "Decisiones arquitectónicas documentadas"
    },
    "constraints": {
      "type": "array",
      "items": {
        "type": "string"
      },
      "description": "Restricciones y limitaciones del proyecto"
    },
    "preferences": {
      "type": "array",
      "items": {
        "type": "string"
      },
      "description": "Preferencias del usuario/equipo"
    },
    "history": {
      "type": "array",
      "items": {
        "type": "object",
        "required": ["timestamp", "author", "event_type", "summary"],
        "properties": {
          "timestamp": {
            "type": "string",
            "format": "date-time"
          },
          "author": {
            "type": "string"
          },
          "event_type": {
            "type": "string",
            "enum": ["INITIAL_CREATION", "UPDATE", "DECISION_ADDED", "COMPONENT_ADDED", "CONSTRAINT_ADDED"]
          },
          "summary": {
            "type": "string"
          }
        }
      },
      "description": "Historial de cambios (append-only)"
    }
  }
}
