{
  "schema_version": "1.0.0",
  "project_name": "ewm-modal-cta",
  "created_on": "2025-07-19T15:00:00Z",
  "last_updated": "2025-07-19T15:00:00Z",
  "purpose": "Descripción del propósito principal del proyecto",
  "core_technologies": [
    "Python",
    "JavaScript",
    "React",
    "Node.js"
  ],
  "components": [
    {
      "name": "backend_api",
      "path": "src/api/",
      "description": "API REST principal del proyecto",
      "responsibilities": [
        "Manejo de autenticación",
        "Procesamiento de datos",
        "Comunicación con base de datos"
      ]
    },
    {
      "name": "frontend_app",
      "path": "src/frontend/",
      "description": "Aplicación web frontend en React",
      "responsibilities": [
        "Interfaz de usuario",
        "Gestión de estado",
        "Comunicación con API"
      ]
    }
  ],
  "decisions": [
    {
      "id": "ADR-001",
      "date": "2025-07-19",
      "decision": "Usar React para el frontend",
      "rationale": "React ofrece mejor ecosistema y performance para nuestras necesidades",
      "status": "Implementado"
    },
    {
      "id": "ADR-002", 
      "date": "2025-07-19",
      "decision": "Implementar autenticación JWT",
      "rationale": "JWT permite autenticación stateless y mejor escalabilidad",
      "status": "Propuesto"
    }
  ],
  "constraints": [
    "Debe ser compatible con navegadores modernos",
    "El tiempo de respuesta de la API debe ser menor a 200ms",
    "Debe soportar al menos 1000 usuarios concurrentes"
  ],
  "preferences": [
    "Preferir TypeScript sobre JavaScript cuando sea posible",
    "Usar testing automatizado para todas las funcionalidades críticas",
    "Mantener cobertura de tests superior al 80%"
  ],
  "history": [
    {
      "timestamp": "2025-07-19T15:00:00Z",
      "author": "augment_agent",
      "event_type": "INITIAL_CREATION",
      "summary": "Creación inicial del documento de arquitectura"
    },
    {
      "timestamp": "2025-07-19T16:00:00Z",
      "author": "user",
      "event_type": "DECISION_ADDED",
      "summary": "Agregada decisión sobre framework frontend"
    },
    {
      "timestamp": "2025-07-19T17:00:00Z",
      "author": "augment_agent",
      "event_type": "COMPONENT_ADDED",
      "summary": "Agregado componente de autenticación"
    }
  ]
}
